{"schema_id":"global-medicines-atlas.bronze-admission","schema_version":2,"decision_id":"aa8fe25bcc844577bfb14170beed027447ae3dbb73b7dbb28aba960fbf65aece","acquisition_id":"4a64b34f2554491a951f3c4a73a48956fccf3b3654b8077e29a3c2ed578b817c","content_id":"b573d1000c8eb223a36372a5df05ed2c6d8e6b963e2ae8bda3ef79cbd4cba534","state":"landed","reason_codes":["m112_existing_pbs_lineage_bound"],"validation_results":[{"check_id":"producer-b1-b2-projection-join","passed":true,"message":"producer:edithatogo/reimbursement-atlas@a93516ed416118bc51c1db2b71ab540fa4d0fe52;b1_event_id:event:4a64b34f2554491a951f3c4a73a48956fccf3b3654b8077e29a3c2ed578b817c;b2_evidence_id:evidence:sha256:b573d1000c8eb223a36372a5df05ed2c6d8e6b963e2ae8bda3ef79cbd4cba534;b2_locator:sha256:b573d1000c8eb223a36372a5df05ed2c6d8e6b963e2ae8bda3ef79cbd4cba534"},{"check_id":"frozen-pbs-object-identity","passed":true,"message":"dataset:edithatogo/reimbursement-atlas;revision:8e062578f14e12cf3238700a93946339da9c5d88;path:raw/pbs/payloads/au_pbs_archive_11050d9ef5b93b05/b573d1000c8eb223a36372a5df05ed2c6d8e6b963e2ae8bda3ef79cbd4cba534.pdf;sha256:b573d1000c8eb223a36372a5df05ed2c6d8e6b963e2ae8bda3ef79cbd4cba534;bytes:70861"}],"reviewer_status":"unreviewed","actor":"global-medicines-atlas:m112-pbs-projected-lineage","decided_at":"2026-10-18T21:34:05Z","supersedes_decision_id":null}
