{"schema_id":"global-medicines-atlas.bronze-admission","schema_version":2,"decision_id":"dc7506c60ebc3127fbe03a83cc1838b315c722c897cd1fe68961b826c3959bda","acquisition_id":"4e1c48b6e971111c71d2b2e6de3d6622e0e8772300f2bfa1cf3fc2106a84f022","content_id":"66d35d80ec7c5e7bbe19f025a075eed5d7af592c4998a5d41ec5497d026b379d","state":"landed","reason_codes":["m112_existing_pbs_lineage_bound"],"validation_results":[{"check_id":"producer-b1-b2-projection-join","passed":true,"message":"producer:edithatogo/reimbursement-atlas@a93516ed416118bc51c1db2b71ab540fa4d0fe52;b1_event_id:event:4e1c48b6e971111c71d2b2e6de3d6622e0e8772300f2bfa1cf3fc2106a84f022;b2_evidence_id:evidence:sha256:66d35d80ec7c5e7bbe19f025a075eed5d7af592c4998a5d41ec5497d026b379d;b2_locator:sha256:66d35d80ec7c5e7bbe19f025a075eed5d7af592c4998a5d41ec5497d026b379d"},{"check_id":"frozen-pbs-object-identity","passed":true,"message":"dataset:edithatogo/reimbursement-atlas;revision:8e062578f14e12cf3238700a93946339da9c5d88;path:raw/pbs/payloads/au_pbs_structured_67b18c326a1212ba/66d35d80ec7c5e7bbe19f025a075eed5d7af592c4998a5d41ec5497d026b379d.zip;sha256:66d35d80ec7c5e7bbe19f025a075eed5d7af592c4998a5d41ec5497d026b379d;bytes:8217160"}],"reviewer_status":"unreviewed","actor":"global-medicines-atlas:m112-pbs-projected-lineage","decided_at":"2026-10-18T21:34:05Z","supersedes_decision_id":null}
