{"schema_id":"global-medicines-atlas.bronze-admission","schema_version":2,"decision_id":"8cae0b891aba73092a75d1638b713b114a63571533d6eeaf3189b2afeb60db56","acquisition_id":"28e07d405f8557be454efd1ef183b37b65368cdd8156b59e5500e3ea671f8620","content_id":"f65fdfa5470b8c95f704feff4cad6dd11fa4ad044682e539871fb6ebf7c5e3dd","state":"landed","reason_codes":["m112_existing_pbs_lineage_bound"],"validation_results":[{"check_id":"producer-b1-b2-projection-join","passed":true,"message":"producer:edithatogo/reimbursement-atlas@a93516ed416118bc51c1db2b71ab540fa4d0fe52;b1_event_id:event:28e07d405f8557be454efd1ef183b37b65368cdd8156b59e5500e3ea671f8620;b2_evidence_id:evidence:sha256:f65fdfa5470b8c95f704feff4cad6dd11fa4ad044682e539871fb6ebf7c5e3dd;b2_locator:sha256:f65fdfa5470b8c95f704feff4cad6dd11fa4ad044682e539871fb6ebf7c5e3dd"},{"check_id":"frozen-pbs-object-identity","passed":true,"message":"dataset:edithatogo/reimbursement-atlas;revision:8e062578f14e12cf3238700a93946339da9c5d88;path:raw/pbs/payloads/au_pbs_archive_88ac430401ed20ec/f65fdfa5470b8c95f704feff4cad6dd11fa4ad044682e539871fb6ebf7c5e3dd.pdf;sha256:f65fdfa5470b8c95f704feff4cad6dd11fa4ad044682e539871fb6ebf7c5e3dd;bytes:406913"}],"reviewer_status":"unreviewed","actor":"global-medicines-atlas:m112-pbs-projected-lineage","decided_at":"2026-10-18T21:34:05Z","supersedes_decision_id":null}
