{"schema_id":"global-medicines-atlas.bronze-admission","schema_version":2,"decision_id":"6e5522f7a3ddd2537957ffb08d570bd77430056e9b41a9a61df9f4d1b937778e","acquisition_id":"36b631227d21c95b5c1a4571ce0bed222cba92e38e9485d5fc6708ed20ff7594","content_id":"16ddc38cd21614c957dfc5b45f9a7ebe243cffcf2b62913e36ce16f82a688c6e","state":"landed","reason_codes":["m112_existing_pbs_lineage_bound"],"validation_results":[{"check_id":"producer-b1-b2-projection-join","passed":true,"message":"producer:edithatogo/reimbursement-atlas@a93516ed416118bc51c1db2b71ab540fa4d0fe52;b1_event_id:event:36b631227d21c95b5c1a4571ce0bed222cba92e38e9485d5fc6708ed20ff7594;b2_evidence_id:evidence:sha256:16ddc38cd21614c957dfc5b45f9a7ebe243cffcf2b62913e36ce16f82a688c6e;b2_locator:sha256:16ddc38cd21614c957dfc5b45f9a7ebe243cffcf2b62913e36ce16f82a688c6e"},{"check_id":"frozen-pbs-object-identity","passed":true,"message":"dataset:edithatogo/reimbursement-atlas;revision:8e062578f14e12cf3238700a93946339da9c5d88;path:raw/pbs/payloads/au_pbs_archive_a9ec7e420eab41d0/16ddc38cd21614c957dfc5b45f9a7ebe243cffcf2b62913e36ce16f82a688c6e.pdf;sha256:16ddc38cd21614c957dfc5b45f9a7ebe243cffcf2b62913e36ce16f82a688c6e;bytes:342144"}],"reviewer_status":"unreviewed","actor":"global-medicines-atlas:m112-pbs-projected-lineage","decided_at":"2026-10-18T21:34:05Z","supersedes_decision_id":null}
