{"schema_id":"global-medicines-atlas.bronze-admission","schema_version":2,"decision_id":"e5ff63bc839af5fb216ff1c440b32d25b8dbbf7d09dbc87d50e4738bfa0e1e92","acquisition_id":"a008e7e3de3af7e6498a5be501c95b900751f1122de92db5ccf0fd46a42f464d","content_id":"0d6656477d98f30ed9a43e82915a28d39a6d7c149c0786a3f516c92e7fdfbd61","state":"landed","reason_codes":["m112_existing_pbs_lineage_bound"],"validation_results":[{"check_id":"producer-b1-b2-projection-join","passed":true,"message":"producer:edithatogo/reimbursement-atlas@a93516ed416118bc51c1db2b71ab540fa4d0fe52;b1_event_id:event:a008e7e3de3af7e6498a5be501c95b900751f1122de92db5ccf0fd46a42f464d;b2_evidence_id:evidence:sha256:0d6656477d98f30ed9a43e82915a28d39a6d7c149c0786a3f516c92e7fdfbd61;b2_locator:sha256:0d6656477d98f30ed9a43e82915a28d39a6d7c149c0786a3f516c92e7fdfbd61"},{"check_id":"frozen-pbs-object-identity","passed":true,"message":"dataset:edithatogo/reimbursement-atlas;revision:8e062578f14e12cf3238700a93946339da9c5d88;path:raw/pbs/payloads/au_pbs_structured_d86266499dc61bef/0d6656477d98f30ed9a43e82915a28d39a6d7c149c0786a3f516c92e7fdfbd61.zip;sha256:0d6656477d98f30ed9a43e82915a28d39a6d7c149c0786a3f516c92e7fdfbd61;bytes:3316104"}],"reviewer_status":"unreviewed","actor":"global-medicines-atlas:m112-pbs-projected-lineage","decided_at":"2026-10-18T21:34:05Z","supersedes_decision_id":null}
