{"schema_id":"global-medicines-atlas.bronze-admission","schema_version":2,"decision_id":"b9837e27adec87534d260ae57412712c4a043bc222d399604308a793703acd9e","acquisition_id":"4d295adee2e922e8055e46290eb54fea43f554dab071019c476b34b2b4b35c43","content_id":"8d2ad404abcb3a4645dd3f9da2933a024170bfdce0c5c11a55474f2b38a9691a","state":"landed","reason_codes":["m112_existing_pbs_lineage_bound"],"validation_results":[{"check_id":"producer-b1-b2-projection-join","passed":true,"message":"producer:edithatogo/reimbursement-atlas@a93516ed416118bc51c1db2b71ab540fa4d0fe52;b1_event_id:event:4d295adee2e922e8055e46290eb54fea43f554dab071019c476b34b2b4b35c43;b2_evidence_id:evidence:sha256:8d2ad404abcb3a4645dd3f9da2933a024170bfdce0c5c11a55474f2b38a9691a;b2_locator:sha256:8d2ad404abcb3a4645dd3f9da2933a024170bfdce0c5c11a55474f2b38a9691a"},{"check_id":"frozen-pbs-object-identity","passed":true,"message":"dataset:edithatogo/reimbursement-atlas;revision:8e062578f14e12cf3238700a93946339da9c5d88;path:raw/pbs/payloads/au_pbs_structured_57054729a02f980a/8d2ad404abcb3a4645dd3f9da2933a024170bfdce0c5c11a55474f2b38a9691a.zip;sha256:8d2ad404abcb3a4645dd3f9da2933a024170bfdce0c5c11a55474f2b38a9691a;bytes:10295380"}],"reviewer_status":"unreviewed","actor":"global-medicines-atlas:m112-pbs-projected-lineage","decided_at":"2026-10-18T21:34:05Z","supersedes_decision_id":null}
