{"schema_id":"global-medicines-atlas.bronze-admission","schema_version":2,"decision_id":"17b9cf5c428fe4bdb00bfcb9cfcbc508a2e1fae3b286847ccfa3f5a80ee29a21","acquisition_id":"2d35d1bebc640048850a7a4ac22bbee2617b82b9e3d77690ce28ae74f164778b","content_id":"559be48093713b0c5ff86ee08a921c9f616bd389f6c15aeff02cacaa8a2f7e67","state":"landed","reason_codes":["m112_existing_pbs_lineage_bound"],"validation_results":[{"check_id":"producer-b1-b2-projection-join","passed":true,"message":"producer:edithatogo/reimbursement-atlas@a93516ed416118bc51c1db2b71ab540fa4d0fe52;b1_event_id:event:2d35d1bebc640048850a7a4ac22bbee2617b82b9e3d77690ce28ae74f164778b;b2_evidence_id:evidence:sha256:559be48093713b0c5ff86ee08a921c9f616bd389f6c15aeff02cacaa8a2f7e67;b2_locator:sha256:559be48093713b0c5ff86ee08a921c9f616bd389f6c15aeff02cacaa8a2f7e67"},{"check_id":"frozen-pbs-object-identity","passed":true,"message":"dataset:edithatogo/reimbursement-atlas;revision:8e062578f14e12cf3238700a93946339da9c5d88;path:raw/pbs/payloads/au_pbs_structured_5171d93ad3bb3239/559be48093713b0c5ff86ee08a921c9f616bd389f6c15aeff02cacaa8a2f7e67.zip;sha256:559be48093713b0c5ff86ee08a921c9f616bd389f6c15aeff02cacaa8a2f7e67;bytes:10707056"}],"reviewer_status":"unreviewed","actor":"global-medicines-atlas:m112-pbs-projected-lineage","decided_at":"2026-10-18T21:34:05Z","supersedes_decision_id":null}
