{"schema_id":"global-medicines-atlas.bronze-admission","schema_version":2,"decision_id":"a6b2c25ff51fd4347aa10b3b24bf1c6140452a80519dc6569a33cc98f6ae7647","acquisition_id":"ac87feede4bb5c7daaba526bb0f3edb9d8424de26e9e3f4bd8aafeab72c9f5e2","content_id":"1a10407a80e49e9cf5054fa5c9beacec77c7a1c79a7686f4d9050facfce41c47","state":"landed","reason_codes":["m112_existing_pbs_lineage_bound"],"validation_results":[{"check_id":"producer-b1-b2-projection-join","passed":true,"message":"producer:edithatogo/reimbursement-atlas@a93516ed416118bc51c1db2b71ab540fa4d0fe52;b1_event_id:event:ac87feede4bb5c7daaba526bb0f3edb9d8424de26e9e3f4bd8aafeab72c9f5e2;b2_evidence_id:evidence:sha256:1a10407a80e49e9cf5054fa5c9beacec77c7a1c79a7686f4d9050facfce41c47;b2_locator:sha256:1a10407a80e49e9cf5054fa5c9beacec77c7a1c79a7686f4d9050facfce41c47"},{"check_id":"frozen-pbs-object-identity","passed":true,"message":"dataset:edithatogo/reimbursement-atlas;revision:8e062578f14e12cf3238700a93946339da9c5d88;path:raw/pbs/payloads/au_pbs_structured_16187cae1ba19ee9/1a10407a80e49e9cf5054fa5c9beacec77c7a1c79a7686f4d9050facfce41c47.zip;sha256:1a10407a80e49e9cf5054fa5c9beacec77c7a1c79a7686f4d9050facfce41c47;bytes:3624077"}],"reviewer_status":"unreviewed","actor":"global-medicines-atlas:m112-pbs-projected-lineage","decided_at":"2026-10-18T21:34:05Z","supersedes_decision_id":null}
