{"schema_id":"global-medicines-atlas.bronze-admission","schema_version":2,"decision_id":"ed5a410193b486960e9a28fa80a4eaa904624800e3a4bbbab66d0c537cba42f5","acquisition_id":"39004caa615adc9fa7c3596b365df298256f38cc56479a720edb613c25bd69f0","content_id":"ccdac79032b84b383d82262b0a4f1fc2e5c3ed890f65e1743496b21d1f37ac85","state":"landed","reason_codes":["m112_existing_pbs_lineage_bound"],"validation_results":[{"check_id":"producer-b1-b2-projection-join","passed":true,"message":"producer:edithatogo/reimbursement-atlas@a93516ed416118bc51c1db2b71ab540fa4d0fe52;b1_event_id:event:39004caa615adc9fa7c3596b365df298256f38cc56479a720edb613c25bd69f0;b2_evidence_id:evidence:sha256:ccdac79032b84b383d82262b0a4f1fc2e5c3ed890f65e1743496b21d1f37ac85;b2_locator:sha256:ccdac79032b84b383d82262b0a4f1fc2e5c3ed890f65e1743496b21d1f37ac85"},{"check_id":"frozen-pbs-object-identity","passed":true,"message":"dataset:edithatogo/reimbursement-atlas;revision:8e062578f14e12cf3238700a93946339da9c5d88;path:raw/pbs/payloads/au_pbs_archive_65af3140307ad3be/ccdac79032b84b383d82262b0a4f1fc2e5c3ed890f65e1743496b21d1f37ac85.pdf;sha256:ccdac79032b84b383d82262b0a4f1fc2e5c3ed890f65e1743496b21d1f37ac85;bytes:1369698"}],"reviewer_status":"unreviewed","actor":"global-medicines-atlas:m112-pbs-projected-lineage","decided_at":"2026-10-18T21:34:05Z","supersedes_decision_id":null}
