{"schema_id":"global-medicines-atlas.bronze-admission","schema_version":2,"decision_id":"ea284fe4cc8531f71049979a0b0396ac1564e36cfbb6b515794674b9f168a595","acquisition_id":"951208dc00f3ac9bd00096fafa87ec9da11352c35a3958e911a81cc937b20f63","content_id":"cf5159c5fd4cc96dda86917ae179b54447c99d75ad83d3fab350463187b6cfd4","state":"landed","reason_codes":["m112_existing_pbs_lineage_bound"],"validation_results":[{"check_id":"producer-b1-b2-projection-join","passed":true,"message":"producer:edithatogo/reimbursement-atlas@a93516ed416118bc51c1db2b71ab540fa4d0fe52;b1_event_id:event:951208dc00f3ac9bd00096fafa87ec9da11352c35a3958e911a81cc937b20f63;b2_evidence_id:evidence:sha256:cf5159c5fd4cc96dda86917ae179b54447c99d75ad83d3fab350463187b6cfd4;b2_locator:sha256:cf5159c5fd4cc96dda86917ae179b54447c99d75ad83d3fab350463187b6cfd4"},{"check_id":"frozen-pbs-object-identity","passed":true,"message":"dataset:edithatogo/reimbursement-atlas;revision:8e062578f14e12cf3238700a93946339da9c5d88;path:raw/pbs/payloads/au_pbs_archive_6bb5c5ea17fb5fb7/cf5159c5fd4cc96dda86917ae179b54447c99d75ad83d3fab350463187b6cfd4.pdf;sha256:cf5159c5fd4cc96dda86917ae179b54447c99d75ad83d3fab350463187b6cfd4;bytes:95212"}],"reviewer_status":"unreviewed","actor":"global-medicines-atlas:m112-pbs-projected-lineage","decided_at":"2026-10-18T21:34:05Z","supersedes_decision_id":null}
