{"schema_id":"global-medicines-atlas.bronze-admission","schema_version":2,"decision_id":"6486b465563accacd3dd8366215208d77dde5e261c37852cd45bf771536698d8","acquisition_id":"592e56fb74d4f673c06d90e8789eaf73100154528d905b9955d80d6af5c2577f","content_id":"615289752fb560d3f1e2c4f27a6822ba2c3170912ede70827c753a3c221c6ba6","state":"landed","reason_codes":["m112_existing_pbs_lineage_bound"],"validation_results":[{"check_id":"producer-b1-b2-projection-join","passed":true,"message":"producer:edithatogo/reimbursement-atlas@a93516ed416118bc51c1db2b71ab540fa4d0fe52;b1_event_id:event:592e56fb74d4f673c06d90e8789eaf73100154528d905b9955d80d6af5c2577f;b2_evidence_id:evidence:sha256:615289752fb560d3f1e2c4f27a6822ba2c3170912ede70827c753a3c221c6ba6;b2_locator:sha256:615289752fb560d3f1e2c4f27a6822ba2c3170912ede70827c753a3c221c6ba6"},{"check_id":"frozen-pbs-object-identity","passed":true,"message":"dataset:edithatogo/reimbursement-atlas;revision:8e062578f14e12cf3238700a93946339da9c5d88;path:raw/pbs/payloads/au_pbs_structured_a61643e3cedffeef/615289752fb560d3f1e2c4f27a6822ba2c3170912ede70827c753a3c221c6ba6.zip;sha256:615289752fb560d3f1e2c4f27a6822ba2c3170912ede70827c753a3c221c6ba6;bytes:1403839"}],"reviewer_status":"unreviewed","actor":"global-medicines-atlas:m112-pbs-projected-lineage","decided_at":"2026-10-18T21:34:05Z","supersedes_decision_id":null}
