{"schema_id":"global-medicines-atlas.bronze-admission","schema_version":2,"decision_id":"0549f6adb07fa46bf48d9c17339da8b2c24246273240f4da961cf4c614392070","acquisition_id":"caa9983c56bd5238103ecc10d384f63917bda3c55de879bf0f8af75b2b117e76","content_id":"5a51b9995af7c49f4e0bbe4c9e031a57e3b86b83ad09c2f8b50013b7687efd0c","state":"landed","reason_codes":["m112_existing_pbs_lineage_bound"],"validation_results":[{"check_id":"producer-b1-b2-projection-join","passed":true,"message":"producer:edithatogo/reimbursement-atlas@a93516ed416118bc51c1db2b71ab540fa4d0fe52;b1_event_id:event:caa9983c56bd5238103ecc10d384f63917bda3c55de879bf0f8af75b2b117e76;b2_evidence_id:evidence:sha256:5a51b9995af7c49f4e0bbe4c9e031a57e3b86b83ad09c2f8b50013b7687efd0c;b2_locator:sha256:5a51b9995af7c49f4e0bbe4c9e031a57e3b86b83ad09c2f8b50013b7687efd0c"},{"check_id":"frozen-pbs-object-identity","passed":true,"message":"dataset:edithatogo/reimbursement-atlas;revision:8e062578f14e12cf3238700a93946339da9c5d88;path:raw/pbs/payloads/au_pbs_structured_31d11d20a19ecb63/5a51b9995af7c49f4e0bbe4c9e031a57e3b86b83ad09c2f8b50013b7687efd0c.zip;sha256:5a51b9995af7c49f4e0bbe4c9e031a57e3b86b83ad09c2f8b50013b7687efd0c;bytes:8447455"}],"reviewer_status":"unreviewed","actor":"global-medicines-atlas:m112-pbs-projected-lineage","decided_at":"2026-10-18T21:34:05Z","supersedes_decision_id":null}
