{"schema_id":"global-medicines-atlas.bronze-admission","schema_version":2,"decision_id":"e668e50f2bc6d1e643efd1ec1db03a37f6950f12465eaba9888248a6e6911533","acquisition_id":"31e0b4c50a75baa7ec47804ade386a9c075a6edf83906ce5382ecc43bf32fc31","content_id":"63e2303cc64e8495655b9a6d653d5dc1342924b282817dc7da7cdc00138a756b","state":"landed","reason_codes":["m112_existing_pbs_lineage_bound"],"validation_results":[{"check_id":"producer-b1-b2-projection-join","passed":true,"message":"producer:edithatogo/reimbursement-atlas@a93516ed416118bc51c1db2b71ab540fa4d0fe52;b1_event_id:event:31e0b4c50a75baa7ec47804ade386a9c075a6edf83906ce5382ecc43bf32fc31;b2_evidence_id:evidence:sha256:63e2303cc64e8495655b9a6d653d5dc1342924b282817dc7da7cdc00138a756b;b2_locator:sha256:63e2303cc64e8495655b9a6d653d5dc1342924b282817dc7da7cdc00138a756b"},{"check_id":"frozen-pbs-object-identity","passed":true,"message":"dataset:edithatogo/reimbursement-atlas;revision:8e062578f14e12cf3238700a93946339da9c5d88;path:raw/pbs/payloads/au_pbs_structured_711c68d2b7c1a843/63e2303cc64e8495655b9a6d653d5dc1342924b282817dc7da7cdc00138a756b.zip;sha256:63e2303cc64e8495655b9a6d653d5dc1342924b282817dc7da7cdc00138a756b;bytes:3727682"}],"reviewer_status":"unreviewed","actor":"global-medicines-atlas:m112-pbs-projected-lineage","decided_at":"2026-10-18T21:34:05Z","supersedes_decision_id":null}
