{"schema_id":"global-medicines-atlas.bronze-admission","schema_version":2,"decision_id":"22fbc9aa3c9ec1cf6650b22c8eef5dfbc91d202181f9a08f944fab6188872ce1","acquisition_id":"477b264dceeece9678d25dd3cbab6391a1bf353a8295a43544723234dd05e453","content_id":"ed9f297d9ded5d0ccbc8302cf0f0ec1b8218af1aa5819a0daff61596253eaf5c","state":"landed","reason_codes":["m112_existing_pbs_lineage_bound"],"validation_results":[{"check_id":"producer-b1-b2-projection-join","passed":true,"message":"producer:edithatogo/reimbursement-atlas@a93516ed416118bc51c1db2b71ab540fa4d0fe52;b1_event_id:event:477b264dceeece9678d25dd3cbab6391a1bf353a8295a43544723234dd05e453;b2_evidence_id:evidence:sha256:ed9f297d9ded5d0ccbc8302cf0f0ec1b8218af1aa5819a0daff61596253eaf5c;b2_locator:sha256:ed9f297d9ded5d0ccbc8302cf0f0ec1b8218af1aa5819a0daff61596253eaf5c"},{"check_id":"frozen-pbs-object-identity","passed":true,"message":"dataset:edithatogo/reimbursement-atlas;revision:8e062578f14e12cf3238700a93946339da9c5d88;path:raw/pbs/payloads/au_pbs_structured_7ec0b3fee80d724a/ed9f297d9ded5d0ccbc8302cf0f0ec1b8218af1aa5819a0daff61596253eaf5c.zip;sha256:ed9f297d9ded5d0ccbc8302cf0f0ec1b8218af1aa5819a0daff61596253eaf5c;bytes:4801368"}],"reviewer_status":"unreviewed","actor":"global-medicines-atlas:m112-pbs-projected-lineage","decided_at":"2026-10-18T21:34:05Z","supersedes_decision_id":null}
