{"schema_id":"global-medicines-atlas.bronze-admission","schema_version":2,"decision_id":"c3293abe7b9c36c0f305cd605cbad3cf6b9eabf1ec014ad52dc7a44be3193e01","acquisition_id":"cc6b1176a276b52b5e5614d3ce8308345075606c64594480184a09412b0d756a","content_id":"6027fe282be054e81ce36c843dbeeffb94461ca5e11cf8ec1f8c3c8666b03e1c","state":"landed","reason_codes":["m112_existing_pbs_lineage_bound"],"validation_results":[{"check_id":"producer-b1-b2-projection-join","passed":true,"message":"producer:edithatogo/reimbursement-atlas@a93516ed416118bc51c1db2b71ab540fa4d0fe52;b1_event_id:event:cc6b1176a276b52b5e5614d3ce8308345075606c64594480184a09412b0d756a;b2_evidence_id:evidence:sha256:6027fe282be054e81ce36c843dbeeffb94461ca5e11cf8ec1f8c3c8666b03e1c;b2_locator:sha256:6027fe282be054e81ce36c843dbeeffb94461ca5e11cf8ec1f8c3c8666b03e1c"},{"check_id":"frozen-pbs-object-identity","passed":true,"message":"dataset:edithatogo/reimbursement-atlas;revision:8e062578f14e12cf3238700a93946339da9c5d88;path:raw/pbs/payloads/au_pbs_structured_d20ea419c943f188/6027fe282be054e81ce36c843dbeeffb94461ca5e11cf8ec1f8c3c8666b03e1c.zip;sha256:6027fe282be054e81ce36c843dbeeffb94461ca5e11cf8ec1f8c3c8666b03e1c;bytes:6523195"}],"reviewer_status":"unreviewed","actor":"global-medicines-atlas:m112-pbs-projected-lineage","decided_at":"2026-10-18T21:34:05Z","supersedes_decision_id":null}
