{"schema_id":"global-medicines-atlas.bronze-admission","schema_version":2,"decision_id":"e4f2801d7e132427b4d9dfaf2c71f63dc491a55d8774025e86f38fe7f37c154c","acquisition_id":"40521cbffdc8312d730b6e1b36b676b3753703c158913c2348169f8e44c0917e","content_id":"d9e80b9852fcfe30ca75dcb02a1caddb1863f3acdd26036457a24a6c2851075e","state":"landed","reason_codes":["m112_existing_pbs_lineage_bound"],"validation_results":[{"check_id":"producer-b1-b2-projection-join","passed":true,"message":"producer:edithatogo/reimbursement-atlas@a93516ed416118bc51c1db2b71ab540fa4d0fe52;b1_event_id:event:40521cbffdc8312d730b6e1b36b676b3753703c158913c2348169f8e44c0917e;b2_evidence_id:evidence:sha256:d9e80b9852fcfe30ca75dcb02a1caddb1863f3acdd26036457a24a6c2851075e;b2_locator:sha256:d9e80b9852fcfe30ca75dcb02a1caddb1863f3acdd26036457a24a6c2851075e"},{"check_id":"frozen-pbs-object-identity","passed":true,"message":"dataset:edithatogo/reimbursement-atlas;revision:8e062578f14e12cf3238700a93946339da9c5d88;path:raw/pbs/payloads/au_pbs_archive_a9d9582adfb5391f/d9e80b9852fcfe30ca75dcb02a1caddb1863f3acdd26036457a24a6c2851075e.pdf;sha256:d9e80b9852fcfe30ca75dcb02a1caddb1863f3acdd26036457a24a6c2851075e;bytes:3373406"}],"reviewer_status":"unreviewed","actor":"global-medicines-atlas:m112-pbs-projected-lineage","decided_at":"2026-10-18T21:34:05Z","supersedes_decision_id":null}
