{"schema_id":"global-medicines-atlas.bronze-admission","schema_version":2,"decision_id":"ad5d8f0f7d21608ae609cfb578ed1d2e050fcfa1b47cf26dafa265b713211bdf","acquisition_id":"b1245cb490251e0a2741aea19d2bac55d62625f5611fb77878707ad8f3b42469","content_id":"dbe190afc1493f7db4ca9a07e564798593912609bc05f393e69d42a63ba3074d","state":"landed","reason_codes":["m112_existing_pbs_lineage_bound"],"validation_results":[{"check_id":"producer-b1-b2-projection-join","passed":true,"message":"producer:edithatogo/reimbursement-atlas@a93516ed416118bc51c1db2b71ab540fa4d0fe52;b1_event_id:event:b1245cb490251e0a2741aea19d2bac55d62625f5611fb77878707ad8f3b42469;b2_evidence_id:evidence:sha256:dbe190afc1493f7db4ca9a07e564798593912609bc05f393e69d42a63ba3074d;b2_locator:sha256:dbe190afc1493f7db4ca9a07e564798593912609bc05f393e69d42a63ba3074d"},{"check_id":"frozen-pbs-object-identity","passed":true,"message":"dataset:edithatogo/reimbursement-atlas;revision:8e062578f14e12cf3238700a93946339da9c5d88;path:raw/pbs/payloads/au_pbs_structured_8299f5de44f3fb89/dbe190afc1493f7db4ca9a07e564798593912609bc05f393e69d42a63ba3074d.zip;sha256:dbe190afc1493f7db4ca9a07e564798593912609bc05f393e69d42a63ba3074d;bytes:2149633"}],"reviewer_status":"unreviewed","actor":"global-medicines-atlas:m112-pbs-projected-lineage","decided_at":"2026-10-18T21:34:05Z","supersedes_decision_id":null}
