{"schema_id":"global-medicines-atlas.bronze-admission","schema_version":2,"decision_id":"9333f5ec6149faa0530b127275cacb7f1939420c25526c1eb632d7cd7dc13e4b","acquisition_id":"cc67d085f788c142f3a579fa1a6be5021cf2dba509209fad04e87f6b79146787","content_id":"4147b743f69a44ec10a2fb74fcff57e8e72b5ecfcc78893bf29d319e848e267f","state":"landed","reason_codes":["m112_existing_pbs_lineage_bound"],"validation_results":[{"check_id":"producer-b1-b2-projection-join","passed":true,"message":"producer:edithatogo/reimbursement-atlas@a93516ed416118bc51c1db2b71ab540fa4d0fe52;b1_event_id:event:cc67d085f788c142f3a579fa1a6be5021cf2dba509209fad04e87f6b79146787;b2_evidence_id:evidence:sha256:4147b743f69a44ec10a2fb74fcff57e8e72b5ecfcc78893bf29d319e848e267f;b2_locator:sha256:4147b743f69a44ec10a2fb74fcff57e8e72b5ecfcc78893bf29d319e848e267f"},{"check_id":"frozen-pbs-object-identity","passed":true,"message":"dataset:edithatogo/reimbursement-atlas;revision:8e062578f14e12cf3238700a93946339da9c5d88;path:raw/pbs/payloads/au_pbs_structured_de0e2bfb7a82599c/4147b743f69a44ec10a2fb74fcff57e8e72b5ecfcc78893bf29d319e848e267f.zip;sha256:4147b743f69a44ec10a2fb74fcff57e8e72b5ecfcc78893bf29d319e848e267f;bytes:3846785"}],"reviewer_status":"unreviewed","actor":"global-medicines-atlas:m112-pbs-projected-lineage","decided_at":"2026-10-18T21:34:05Z","supersedes_decision_id":null}
