{"schema_id":"global-medicines-atlas.bronze-admission","schema_version":2,"decision_id":"f5abcb4c5375d0fdffcb2cde39e52bec2c24596fea9b5c019fb6f121efabfaf5","acquisition_id":"3f5af304c1bb1e18b01a1ec49992c4c9f8c745fa8e0b8fc7f7095e3afa0b4cea","content_id":"c7168e69666bffad87c3dcd5c673267c4989266eb3498610ccf11c95bff9550e","state":"landed","reason_codes":["m112_existing_pbs_lineage_bound"],"validation_results":[{"check_id":"producer-b1-b2-projection-join","passed":true,"message":"producer:edithatogo/reimbursement-atlas@a93516ed416118bc51c1db2b71ab540fa4d0fe52;b1_event_id:event:3f5af304c1bb1e18b01a1ec49992c4c9f8c745fa8e0b8fc7f7095e3afa0b4cea;b2_evidence_id:evidence:sha256:c7168e69666bffad87c3dcd5c673267c4989266eb3498610ccf11c95bff9550e;b2_locator:sha256:c7168e69666bffad87c3dcd5c673267c4989266eb3498610ccf11c95bff9550e"},{"check_id":"frozen-pbs-object-identity","passed":true,"message":"dataset:edithatogo/reimbursement-atlas;revision:8e062578f14e12cf3238700a93946339da9c5d88;path:raw/pbs/payloads/au_pbs_structured_9e640464bce6170b/c7168e69666bffad87c3dcd5c673267c4989266eb3498610ccf11c95bff9550e.zip;sha256:c7168e69666bffad87c3dcd5c673267c4989266eb3498610ccf11c95bff9550e;bytes:887214"}],"reviewer_status":"unreviewed","actor":"global-medicines-atlas:m112-pbs-projected-lineage","decided_at":"2026-10-18T21:34:05Z","supersedes_decision_id":null}
