{"schema_id":"global-medicines-atlas.bronze-admission","schema_version":2,"decision_id":"96a28aaea1796dbb1b18339af1a0faa2127d355459ade5905370e4cf1bf7dcfe","acquisition_id":"96c5f3c654a7108dd39a708f2d0606ca2a5da5ea20bce2981abaef2585385e5f","content_id":"5ce62794150e9a511cdcb1824a6704e97c0b1d4e783825443f70540e4437047a","state":"landed","reason_codes":["m112_existing_pbs_lineage_bound"],"validation_results":[{"check_id":"producer-b1-b2-projection-join","passed":true,"message":"producer:edithatogo/reimbursement-atlas@a93516ed416118bc51c1db2b71ab540fa4d0fe52;b1_event_id:event:96c5f3c654a7108dd39a708f2d0606ca2a5da5ea20bce2981abaef2585385e5f;b2_evidence_id:evidence:sha256:5ce62794150e9a511cdcb1824a6704e97c0b1d4e783825443f70540e4437047a;b2_locator:sha256:5ce62794150e9a511cdcb1824a6704e97c0b1d4e783825443f70540e4437047a"},{"check_id":"frozen-pbs-object-identity","passed":true,"message":"dataset:edithatogo/reimbursement-atlas;revision:8e062578f14e12cf3238700a93946339da9c5d88;path:raw/pbs/payloads/au_pbs_structured_376b0f974ab3bec5/5ce62794150e9a511cdcb1824a6704e97c0b1d4e783825443f70540e4437047a.zip;sha256:5ce62794150e9a511cdcb1824a6704e97c0b1d4e783825443f70540e4437047a;bytes:2869208"}],"reviewer_status":"unreviewed","actor":"global-medicines-atlas:m112-pbs-projected-lineage","decided_at":"2026-10-18T21:34:05Z","supersedes_decision_id":null}
