{"schema_id":"global-medicines-atlas.bronze-admission","schema_version":2,"decision_id":"3fe2ae9ef60648aefe1bcbe593593a0104131c0bdd3eca4ed8173af8727e493e","acquisition_id":"6c40b06c0468c0bf0ffb7a10be037ac42afd0615a0d04ba72d7bb7b32a8a5452","content_id":"2a6706ab0eda6c03a6fbcf2baf3b0f8e2f0f4a793d3a508dd4bb97b3c5ac903a","state":"landed","reason_codes":["m112_existing_pbs_lineage_bound"],"validation_results":[{"check_id":"producer-b1-b2-projection-join","passed":true,"message":"producer:edithatogo/reimbursement-atlas@a93516ed416118bc51c1db2b71ab540fa4d0fe52;b1_event_id:event:6c40b06c0468c0bf0ffb7a10be037ac42afd0615a0d04ba72d7bb7b32a8a5452;b2_evidence_id:evidence:sha256:2a6706ab0eda6c03a6fbcf2baf3b0f8e2f0f4a793d3a508dd4bb97b3c5ac903a;b2_locator:sha256:2a6706ab0eda6c03a6fbcf2baf3b0f8e2f0f4a793d3a508dd4bb97b3c5ac903a"},{"check_id":"frozen-pbs-object-identity","passed":true,"message":"dataset:edithatogo/reimbursement-atlas;revision:8e062578f14e12cf3238700a93946339da9c5d88;path:raw/pbs/payloads/au_pbs_archive_3e509d79b5dd773e/2a6706ab0eda6c03a6fbcf2baf3b0f8e2f0f4a793d3a508dd4bb97b3c5ac903a.pdf;sha256:2a6706ab0eda6c03a6fbcf2baf3b0f8e2f0f4a793d3a508dd4bb97b3c5ac903a;bytes:660365"}],"reviewer_status":"unreviewed","actor":"global-medicines-atlas:m112-pbs-projected-lineage","decided_at":"2026-10-18T21:34:05Z","supersedes_decision_id":null}
