{"schema_id":"global-medicines-atlas.bronze-admission","schema_version":2,"decision_id":"634ef56b835289f71048bc962a15ed291fb27ce7707384470bdf4778289298ca","acquisition_id":"4aa3106da99cfc35685e13795ffd90025685c780c19203c9e70f3636c894c96d","content_id":"eb2332f7c2daf769cf0b28c64d869a5c66e1a3646d4448b37be71778fd84cc6a","state":"landed","reason_codes":["m112_existing_pbs_lineage_bound"],"validation_results":[{"check_id":"producer-b1-b2-projection-join","passed":true,"message":"producer:edithatogo/reimbursement-atlas@a93516ed416118bc51c1db2b71ab540fa4d0fe52;b1_event_id:event:4aa3106da99cfc35685e13795ffd90025685c780c19203c9e70f3636c894c96d;b2_evidence_id:evidence:sha256:eb2332f7c2daf769cf0b28c64d869a5c66e1a3646d4448b37be71778fd84cc6a;b2_locator:sha256:eb2332f7c2daf769cf0b28c64d869a5c66e1a3646d4448b37be71778fd84cc6a"},{"check_id":"frozen-pbs-object-identity","passed":true,"message":"dataset:edithatogo/reimbursement-atlas;revision:8e062578f14e12cf3238700a93946339da9c5d88;path:raw/pbs/payloads/au_pbs_archive_9e262d63ea878bb4/eb2332f7c2daf769cf0b28c64d869a5c66e1a3646d4448b37be71778fd84cc6a.pdf;sha256:eb2332f7c2daf769cf0b28c64d869a5c66e1a3646d4448b37be71778fd84cc6a;bytes:2765669"}],"reviewer_status":"unreviewed","actor":"global-medicines-atlas:m112-pbs-projected-lineage","decided_at":"2026-10-18T21:34:05Z","supersedes_decision_id":null}
