{"schema_id":"global-medicines-atlas.bronze-admission","schema_version":2,"decision_id":"b6638790c91f6f2557e862eaf85f281a7d292c71b85d3d6e28c0e577abc9b6e3","acquisition_id":"e09f49efa6f07e4f10da0bc2e0a87c0ed1c959145b1abe86f8bd67a43e0d4c24","content_id":"0fd52fec955c1d12a7d2885afd22a644c44eee9d2c37ebe83310e49ba8eab7ab","state":"landed","reason_codes":["m112_existing_pbs_lineage_bound"],"validation_results":[{"check_id":"producer-b1-b2-projection-join","passed":true,"message":"producer:edithatogo/reimbursement-atlas@a93516ed416118bc51c1db2b71ab540fa4d0fe52;b1_event_id:event:e09f49efa6f07e4f10da0bc2e0a87c0ed1c959145b1abe86f8bd67a43e0d4c24;b2_evidence_id:evidence:sha256:0fd52fec955c1d12a7d2885afd22a644c44eee9d2c37ebe83310e49ba8eab7ab;b2_locator:sha256:0fd52fec955c1d12a7d2885afd22a644c44eee9d2c37ebe83310e49ba8eab7ab"},{"check_id":"frozen-pbs-object-identity","passed":true,"message":"dataset:edithatogo/reimbursement-atlas;revision:8e062578f14e12cf3238700a93946339da9c5d88;path:raw/pbs/payloads/au_pbs_archive_d1f4cc30128f1749/0fd52fec955c1d12a7d2885afd22a644c44eee9d2c37ebe83310e49ba8eab7ab.pdf;sha256:0fd52fec955c1d12a7d2885afd22a644c44eee9d2c37ebe83310e49ba8eab7ab;bytes:26400718"}],"reviewer_status":"unreviewed","actor":"global-medicines-atlas:m112-pbs-projected-lineage","decided_at":"2026-10-18T21:34:05Z","supersedes_decision_id":null}
