{"schema_id":"global-medicines-atlas.bronze-admission","schema_version":2,"decision_id":"6be147c54e2b3b4f16311f1c96b16b83702bfc53253041a635afdc388f5b9663","acquisition_id":"20f23d7f9f74fc1dacf3cf3eaa5d2be9c44c6fc504f5419f1c6e4ac6896e3d71","content_id":"602acf9b8a5531484d0c2614cea2c7104e5cc7eeeca1ea7ddd8c1e639402b911","state":"landed","reason_codes":["m112_existing_pbs_lineage_bound"],"validation_results":[{"check_id":"producer-b1-b2-projection-join","passed":true,"message":"producer:edithatogo/reimbursement-atlas@a93516ed416118bc51c1db2b71ab540fa4d0fe52;b1_event_id:event:20f23d7f9f74fc1dacf3cf3eaa5d2be9c44c6fc504f5419f1c6e4ac6896e3d71;b2_evidence_id:evidence:sha256:602acf9b8a5531484d0c2614cea2c7104e5cc7eeeca1ea7ddd8c1e639402b911;b2_locator:sha256:602acf9b8a5531484d0c2614cea2c7104e5cc7eeeca1ea7ddd8c1e639402b911"},{"check_id":"frozen-pbs-object-identity","passed":true,"message":"dataset:edithatogo/reimbursement-atlas;revision:8e062578f14e12cf3238700a93946339da9c5d88;path:raw/pbs/payloads/au_pbs_archive_79a2bb1d2ca7c4d2/602acf9b8a5531484d0c2614cea2c7104e5cc7eeeca1ea7ddd8c1e639402b911.pdf;sha256:602acf9b8a5531484d0c2614cea2c7104e5cc7eeeca1ea7ddd8c1e639402b911;bytes:11228990"}],"reviewer_status":"unreviewed","actor":"global-medicines-atlas:m112-pbs-projected-lineage","decided_at":"2026-10-18T21:34:05Z","supersedes_decision_id":null}
